<?xml version="1.0" encoding="UTF-8" ?>
<!ELEMENT autos (auto*)>
<!ELEMENT auto (marca, modelo, año)>
<!ELEMENT marca (#PCDATA)>
<!ELEMENT modelo (#PCDATA)>
<!ELEMENT año (#PCDATA)>




